{
  "schema_version": "1.0",
  "case_id": "dev-candidate-fifo-001",
  "task_id": "fifo_sync_v1",
  "candidate_origin": "real_hy3",
  "source_run": "runs/calibration/fifo-001",
  "source_hashes": {
    "process_sha256": "e97e6918fd547f8751929fab416bfd299c7f69d95f648d41e38ff04775792561",
    "evidence_sha256": "eeb725810ba4a86679cd0a969f67bc80b54359a05fae5b973adb98f09277a887",
    "report_sha256": "94f6fb0ce650a9eae2a8fe03f6329b0563feef1caaf10719a233d61c6e8be52a"
  },
  "candidate_process": {
    "task_id": "fifo_sync_v1",
    "architecture_summary": "Circular register-file FIFO with occupancy counter and wrapping pointers; full/empty derived combinationally from occupancy; registered dout with hold.",
    "stages": [
      {
        "id": "S1",
        "title": "Specification Understanding",
        "items": [
          {
            "id": "S1.1",
            "stage": "S1",
            "claim": "Synchronous high rst empties FIFO, clears full, asserts empty, and zeroes dout.",
            "maps_to": [
              "O_RESET"
            ],
            "claimed_dependencies": [],
            "reads": [],
            "writes": [],
            "rtl_blocks": []
          },
          {
            "id": "S1.2",
            "stage": "S1",
            "claim": "full and empty are current-state flags: full iff occupancy==DEPTH, empty iff occupancy==0.",
            "maps_to": [
              "O_FLAGS"
            ],
            "claimed_dependencies": [],
            "reads": [],
            "writes": [],
            "rtl_blocks": []
          },
          {
            "id": "S1.3",
            "stage": "S1",
            "claim": "Read accepted iff rd_en && !empty; write accepted iff wr_en && (!full || simultaneous read accepted). Boundary cases handled.",
            "maps_to": [
              "O_READ_ACCEPT",
              "O_WRITE_ACCEPT",
              "O_FULL_SIMULTANEOUS",
              "O_EMPTY_SIMULTANEOUS"
            ],
            "claimed_dependencies": [],
            "reads": [],
            "writes": [],
            "rtl_blocks": []
          },
          {
            "id": "S1.4",
            "stage": "S1",
            "claim": "Occupancy changes by accepted writes minus reads; FIFO is first-in-first-out; dout updates one cycle after accepted read and holds otherwise.",
            "maps_to": [
              "O_OCCUPANCY",
              "O_ORDERING",
              "O_DOUT_HOLD"
            ],
            "claimed_dependencies": [],
            "reads": [],
            "writes": [],
            "rtl_blocks": []
          }
        ]
      },
      {
        "id": "S2",
        "title": "Architecture / State Modeling",
        "items": [
          {
            "id": "S2.1",
            "stage": "S2",
            "claim": "Use circular buffer: register array mem[DEPTH] with write pointer wptr and read pointer rptr wrapping at DEPTH-1.",
            "maps_to": [
              "O_ORDERING"
            ],
            "claimed_dependencies": [
              "S1.4",
              "S1.3"
            ],
            "reads": [],
            "writes": [
              "mem",
              "wptr",
              "rptr"
            ],
            "rtl_blocks": []
          },
          {
            "id": "S2.2",
            "stage": "S2",
            "claim": "Maintain occupancy counter occ (0..DEPTH) as single source for full/empty and accept logic.",
            "maps_to": [
              "O_FLAGS",
              "O_OCCUPANCY"
            ],
            "claimed_dependencies": [
              "S1.2",
              "S1.1"
            ],
            "reads": [
              "occ"
            ],
            "writes": [
              "occ",
              "full",
              "empty"
            ],
            "rtl_blocks": []
          },
          {
            "id": "S2.3",
            "stage": "S2",
            "claim": "Register dout from mem[rptr] on accepted read; hold otherwise; reset to zero.",
            "maps_to": [
              "O_DOUT_HOLD",
              "O_RESET"
            ],
            "claimed_dependencies": [
              "S1.1",
              "S1.4"
            ],
            "reads": [
              "mem",
              "rptr"
            ],
            "writes": [
              "dout"
            ],
            "rtl_blocks": []
          }
        ]
      },
      {
        "id": "S3",
        "title": "Transition & Temporal Rules",
        "items": [
          {
            "id": "S3.1",
            "stage": "S3",
            "claim": "On posedge clk with rst, set occ<=0, wptr<=0, rptr<=0, dout<=0 (flags follow occ).",
            "maps_to": [
              "O_RESET"
            ],
            "claimed_dependencies": [
              "S2.2",
              "S2.3",
              "S1.1"
            ],
            "reads": [
              "rst"
            ],
            "writes": [
              "occ",
              "wptr",
              "rptr",
              "dout"
            ],
            "rtl_blocks": [
              "always_ff_reset"
            ]
          },
          {
            "id": "S3.2",
            "stage": "S3",
            "claim": "Combinational accept: read_accept = rd_en && !empty; write_accept = wr_en && (!full || read_accept).",
            "maps_to": [
              "O_READ_ACCEPT",
              "O_WRITE_ACCEPT",
              "O_FULL_SIMULTANEOUS",
              "O_EMPTY_SIMULTANEOUS"
            ],
            "claimed_dependencies": [
              "S2.2",
              "S1.3"
            ],
            "reads": [
              "rd_en",
              "wr_en",
              "full",
              "empty"
            ],
            "writes": [
              "read_accept",
              "write_accept"
            ],
            "rtl_blocks": [
              "accept_logic"
            ]
          },
          {
            "id": "S3.3",
            "stage": "S3",
            "claim": "If write_accept: mem[wptr]<=din, wptr wraps; if read_accept: dout<=mem[rptr], rptr wraps; occ<=occ+write_accept-read_accept.",
            "maps_to": [
              "O_OCCUPANCY",
              "O_ORDERING",
              "O_DOUT_HOLD"
            ],
            "claimed_dependencies": [
              "S3.2",
              "S2.1",
              "S2.3"
            ],
            "reads": [
              "write_accept",
              "read_accept",
              "wptr",
              "rptr",
              "din",
              "mem"
            ],
            "writes": [
              "mem",
              "wptr",
              "dout",
              "rptr",
              "occ"
            ],
            "rtl_blocks": [
              "always_ff_update"
            ]
          }
        ]
      },
      {
        "id": "S4",
        "title": "Candidate Properties",
        "items": [
          {
            "id": "S4.1",
            "stage": "S4",
            "claim": "Candidate: occ stays within 0 <= occ <= DEPTH for all cycles.",
            "maps_to": [
              "O_OCCUPANCY"
            ],
            "claimed_dependencies": [
              "S3.3"
            ],
            "reads": [
              "occ"
            ],
            "writes": [],
            "rtl_blocks": []
          },
          {
            "id": "S4.2",
            "stage": "S4",
            "claim": "Candidate: full == (occ==DEPTH) and empty == (occ==0) always hold.",
            "maps_to": [
              "O_FLAGS"
            ],
            "claimed_dependencies": [
              "S2.2"
            ],
            "reads": [
              "occ",
              "full",
              "empty"
            ],
            "writes": [],
            "rtl_blocks": []
          },
          {
            "id": "S4.3",
            "stage": "S4",
            "claim": "Candidate: when read_accept, post-edge dout equals mem at pre-edge rptr (oldest word).",
            "maps_to": [
              "O_ORDERING"
            ],
            "claimed_dependencies": [
              "S3.3"
            ],
            "reads": [
              "dout",
              "mem",
              "rptr"
            ],
            "writes": [],
            "rtl_blocks": []
          },
          {
            "id": "S4.4",
            "stage": "S4",
            "claim": "Candidate: when full and both enables, occ unchanged and both pointers advance.",
            "maps_to": [
              "O_FULL_SIMULTANEOUS"
            ],
            "claimed_dependencies": [
              "S3.2",
              "S3.3"
            ],
            "reads": [
              "occ",
              "wptr",
              "rptr"
            ],
            "writes": [],
            "rtl_blocks": []
          }
        ]
      },
      {
        "id": "S5",
        "title": "RTL Implementation",
        "items": [
          {
            "id": "S5.1",
            "stage": "S5",
            "claim": "Module fifo_sync with DATA_WIDTH, DEPTH params and exact port list as frozen interface.",
            "maps_to": [
              "O_RESET"
            ],
            "claimed_dependencies": [
              "S1.1"
            ],
            "reads": [
              "clk",
              "rst",
              "wr_en",
              "rd_en",
              "din"
            ],
            "writes": [
              "dout",
              "full",
              "empty"
            ],
            "rtl_blocks": [
              "module_fifo_sync"
            ]
          },
          {
            "id": "S5.2",
            "stage": "S5",
            "claim": "Sequential always_ff implements reset and S3.2/S3.3 datapath using mem, pointers, occ, dout.",
            "maps_to": [
              "O_OCCUPANCY",
              "O_ORDERING",
              "O_DOUT_HOLD",
              "O_WRITE_ACCEPT",
              "O_READ_ACCEPT"
            ],
            "claimed_dependencies": [
              "S3.1",
              "S3.2",
              "S3.3"
            ],
            "reads": [